{
  "robot_name": "scout_pico2",
  "kinematics": "DIFFERENTIAL_DRIVE",
  "mcu": "PICO2",
  "transport": "SERIAL",
  "geometry": {
    "wheel_diameter": 0.080,
    "track_width": 0.220
  },
  "motors": {
    "driver_type": "GENERIC_2_IN",
    "max_rpm": 330,
    "cpr": 1320,
    "operating_voltage": 12.0,
    "max_voltage": 12.0,
    "pwm_frequency": 20000,
    "motor1_inv": false,
    "motor2_inv": true
  },
  "sensors": {
    "imu": "BNO085",
    "mag": "NONE",
    "battery_monitor": "ADC_DIVIDER",
    "sonar": true
  },
  "pins": {
    "led": 25,
    "motor1": { "pwm": 14, "in_a": 15, "in_b": 13 },
    "motor2": { "pwm": 16, "in_a": 17, "in_b": 12 },
    "encoders": { "m1_a": 2, "m1_b": 3, "m2_a": 4, "m2_b": 5 },
    "i2c": { "sda": 8, "scl": 9 },
    "battery_pin": 26,
    "sonar": { "trig": 18, "echo": 19 }
  }
}
