{
  "robot_name": "mech_esp32",
  "kinematics": "MECANUM",
  "mcu": "ESP32",
  "transport": "WIFI_UDP",
  "wifi_settings": {
    "ssid": "YOUR_WIFI_SSID",
    "password": "YOUR_WIFI_PASSWORD",
    "agent_ip": "192.168.1.100",
    "agent_port": 8888
  },
  "geometry": {
    "wheel_diameter": 0.080,
    "track_width": 0.28,
    "wheelbase": 0.24
  },
  "motors": {
    "driver_type": "GENERIC_2_IN",
    "max_rpm": 300,
    "cpr": 1500,
    "operating_voltage": 12.0
  },
  "sensors": {
    "imu": "BNO085",
    "mag": "NONE",
    "battery_monitor": "INA219"
  },
  "pins": {
    "led": 2,
    "motor1": { "pwm": 13, "in_a": 14, "in_b": 27 },
    "motor2": { "pwm": 25, "in_a": 26, "in_b": 33 },
    "motor3": { "pwm": 16, "in_a": 17, "in_b": 5 },
    "motor4": { "pwm": 18, "in_a": 19, "in_b": 23 },
    "encoders": {
      "m1_a": 4, "m1_b": 32,
      "m2_a": 35, "m2_b": 34,
      "m3_a": 36, "m3_b": 39,
      "m4_a": 21, "m4_b": 22
    },
    "i2c": { "sda": 21, "scl": 22 }
  }
}
